{"Session": [{"id": "B099ST26S3", "title": "Neal's Yard Remedies Geranium and Orange Foaming Bath | Promote Calmness & Wellbeing | 200ml", "price": 11.25, "brand": "Neal's Yard Remedies", "size": "200 ml (Pack of 1)", "model": "0838", "desc": "Helps promote a feeling of calm and wellbeing"}, {"id": "B001M4C34O", "title": "Neal's Yard Remedies Seaweed and Arnica Foaming Bath | Ease Tiredness & Restore Vitality | 200 ml", "price": 10.0, "brand": "Neal's Yard Remedies", "size": "1 Count (Pack of 1)", "model": "0120", "desc": "Directions: Directions: Pour liberally under running water. For adult use only."}, {"id": "B082MVK3C6", "title": "Neal's Yard Remedies Mothers Bath Oil | Encourages a Sense of Wellbeing | 100ml", "price": 15.0, "brand": "Neal's Yard Remedies", "size": "100 ml (Pack of 1)", "model": "1660", "desc": "Boosts skin’s suppleness"}, {"id": "1787009726", "title": "Magnetic Let's Play", "price": 6.29, "brand": "Imagine That Publishing", "author": "Clover, Alfie"}], "Message": "Below is a user chronological record list:\n[{'id': 'B099ST26S3', 'title': \"Neal's Yard Remedies Geranium and Orange Foaming Bath | Promote Calmness & Wellbeing | 200ml\", 'price': 11.25, 'brand': \"Neal's Yard Remedies\", 'size': '200 ml (Pack of 1)', 'model': '0838', 'desc': 'Helps promote a feeling of calm and wellbeing'}, {'id': 'B001M4C34O', 'title': \"Neal's Yard Remedies Seaweed and Arnica Foaming Bath | Ease Tiredness & Restore Vitality | 200 ml\", 'price': 10.0, 'brand': \"Neal's Yard Remedies\", 'size': '1 Count (Pack of 1)', 'model': '0120', 'desc': 'Directions: Directions: Pour liberally under running water. For adult use only.'}, {'id': 'B082MVK3C6', 'title': \"Neal's Yard Remedies Mothers Bath Oil | Encourages a Sense of Wellbeing | 100ml\", 'price': 15.0, 'brand': \"Neal's Yard Remedies\", 'size': '100 ml (Pack of 1)', 'model': '1660', 'desc': 'Boosts skin’s suppleness'}, {'id': '1787009726', 'title': \"Magnetic Let's Play\", 'price': 6.29, 'brand': 'Imagine That Publishing', 'author': 'Clover, Alfie'}]\nExplain the basic intentions of this user exactly. Output several different intentions one by one to answer the following question: User buy these items because they want to:\nintention 1: {a simple verb phrase within 10 words}\nintention 2: {a simple verb phrase within 10 words}....\n", "Answer": "Intention 1: Promote calmness and wellbeing during bath time.\nIntention 2: Ease tiredness and restore vitality during bath time.\nIntention 3: Encourage a sense of wellbeing during bath time.\nIntention 4: Enjoy a children's book called \"Magnetic Let's Play\".", "Next_item": "1788006666", "Prompt_tokens": 406, "Completion_tokens": 63, "Intentions": ["Promote calmness and wellbeing during bath time.", "Ease tiredness and restore vitality during bath time.", "Encourage a sense of wellbeing during bath time.", "Enjoy a children's book called \"Magnetic Let's Play\"."]}
{"Session": [{"id": "B07S8PG4L1", "title": "Salt of the Earth Amber and Sandalwood Natural Deodorant Spray (100ml)", "price": 6.99, "brand": "Crystal Spring Consumer Division Ltd", "size": "100 ml (Pack of 1)", "model": "CRYS100AS", "desc": "★ 100% NATURAL DEODORANT - Certified COSMOS Natural. Free from Aluminium Chlorohydrate, it's 100% natural, gentle on your skin and made from a mix of natural mineral salts, essential oils and aloe vera."}, {"id": "B08FDB1TV3", "title": "Salt Of the Earth Natural Deodorant Spray by Vegan Long Lasting Protection Refillable Leaping Bunny Approved, Cloudy, Ginger & Jasmine, 100 ml", "price": 6.99, "brand": "Crystal Spring Consumer Division Ltd", "color": "cloudy", "size": "100 ml (Pack of 1)", "model": "CRYS100GJ-C", "desc": "★ 100% NATURAL DEODORANT - Certified COSMOS Natural. Free from Aluminium Chlorohydrate, it's 100% natural, gentle on your skin and made from a mix of natural mineral salts, essential oils and aloe vera."}, {"id": "B001F41IXI", "title": "Natural Deodorant Spray by Salt of the Earth, Unscented, Fragrance Free - Vegan, Long Lasting Protection, Leaping Bunny Approved, Made in the UK - 100ml", "price": 3.39, "brand": "Crystal Spring Consumer Division Ltd", "size": "100 ml (Pack of 1)", "model": "CRYS17", "material": "Plastic", "desc": "★ 100% NATURAL DEODORANT - Certified COSMOS Natural. Free from Aluminium Chlorohydrate and controversial chemicals, it's 100% natural, gentle on your skin and made from a mix of natural mineral salts, essential oils and aloe vera."}, {"id": "B07S8PG4L1", "title": "Salt of the Earth Amber and Sandalwood Natural Deodorant Spray (100ml)", "price": 6.99, "brand": "Crystal Spring Consumer Division Ltd", "size": "100 ml (Pack of 1)", "model": "CRYS100AS", "desc": "★ 100% NATURAL DEODORANT - Certified COSMOS Natural. Free from Aluminium Chlorohydrate, it's 100% natural, gentle on your skin and made from a mix of natural mineral salts, essential oils and aloe vera."}, {"id": "B08FDB1TV3", "title": "Salt Of the Earth Natural Deodorant Spray by Vegan Long Lasting Protection Refillable Leaping Bunny Approved, Cloudy, Ginger & Jasmine, 100 ml", "price": 6.99, "brand": "Crystal Spring Consumer Division Ltd", "color": "cloudy", "size": "100 ml (Pack of 1)", "model": "CRYS100GJ-C", "desc": "★ 100% NATURAL DEODORANT - Certified COSMOS Natural. Free from Aluminium Chlorohydrate, it's 100% natural, gentle on your skin and made from a mix of natural mineral salts, essential oils and aloe vera."}, {"id": "B001F41IXI", "title": "Natural Deodorant Spray by Salt of the Earth, Unscented, Fragrance Free - Vegan, Long Lasting Protection, Leaping Bunny Approved, Made in the UK - 100ml", "price": 3.39, "brand": "Crystal Spring Consumer Division Ltd", "size": "100 ml (Pack of 1)", "model": "CRYS17", "material": "Plastic", "desc": "★ 100% NATURAL DEODORANT - Certified COSMOS Natural. Free from Aluminium Chlorohydrate and controversial chemicals, it's 100% natural, gentle on your skin and made from a mix of natural mineral salts, essential oils and aloe vera."}, {"id": "B00JXMM9KU", "title": "ghd 25 mm Size 1 Ceramic Vented Radial Brush B0-CER25MM", "price": 17.5, "brand": "ghd", "color": "Black", "size": "1 Count (Pack of 1)", "model": "PB104BCORXROWXA", "material": "Ceramic", "desc": "25mm diameter barrel"}, {"id": "B00JXMCZMC", "title": "ghd 35 mm Size 2 Ceramic Vented Radial Brush", "price": 15.0, "brand": "ghd", "color": "Black", "size": "Size 2", "model": "PB105BCORXROWXA", "material": "Ceramic", "desc": "35mm diameter barrel"}], "Message": "Below is a user chronological record list:\n[{'id': 'B07S8PG4L1', 'title': 'Salt of the Earth Amber and Sandalwood Natural Deodorant Spray (100ml)', 'price': 6.99, 'brand': 'Crystal Spring Consumer Division Ltd', 'size': '100 ml (Pack of 1)', 'model': 'CRYS100AS', 'desc': \"★ 100% NATURAL DEODORANT - Certified COSMOS Natural. Free from Aluminium Chlorohydrate, it's 100% natural, gentle on your skin and made from a mix of natural mineral salts, essential oils and aloe vera.\"}, {'id': 'B08FDB1TV3', 'title': 'Salt Of the Earth Natural Deodorant Spray by Vegan Long Lasting Protection Refillable Leaping Bunny Approved, Cloudy, Ginger & Jasmine, 100 ml', 'price': 6.99, 'brand': 'Crystal Spring Consumer Division Ltd', 'color': 'cloudy', 'size': '100 ml (Pack of 1)', 'model': 'CRYS100GJ-C', 'desc': \"★ 100% NATURAL DEODORANT - Certified COSMOS Natural. Free from Aluminium Chlorohydrate, it's 100% natural, gentle on your skin and made from a mix of natural mineral salts, essential oils and aloe vera.\"}, {'id': 'B001F41IXI', 'title': 'Natural Deodorant Spray by Salt of the Earth, Unscented, Fragrance Free - Vegan, Long Lasting Protection, Leaping Bunny Approved, Made in the UK - 100ml', 'price': 3.39, 'brand': 'Crystal Spring Consumer Division Ltd', 'size': '100 ml (Pack of 1)', 'model': 'CRYS17', 'material': 'Plastic', 'desc': \"★ 100% NATURAL DEODORANT - Certified COSMOS Natural. Free from Aluminium Chlorohydrate and controversial chemicals, it's 100% natural, gentle on your skin and made from a mix of natural mineral salts, essential oils and aloe vera.\"}, {'id': 'B07S8PG4L1', 'title': 'Salt of the Earth Amber and Sandalwood Natural Deodorant Spray (100ml)', 'price': 6.99, 'brand': 'Crystal Spring Consumer Division Ltd', 'size': '100 ml (Pack of 1)', 'model': 'CRYS100AS', 'desc': \"★ 100% NATURAL DEODORANT - Certified COSMOS Natural. Free from Aluminium Chlorohydrate, it's 100% natural, gentle on your skin and made from a mix of natural mineral salts, essential oils and aloe vera.\"}, {'id': 'B08FDB1TV3', 'title': 'Salt Of the Earth Natural Deodorant Spray by Vegan Long Lasting Protection Refillable Leaping Bunny Approved, Cloudy, Ginger & Jasmine, 100 ml', 'price': 6.99, 'brand': 'Crystal Spring Consumer Division Ltd', 'color': 'cloudy', 'size': '100 ml (Pack of 1)', 'model': 'CRYS100GJ-C', 'desc': \"★ 100% NATURAL DEODORANT - Certified COSMOS Natural. Free from Aluminium Chlorohydrate, it's 100% natural, gentle on your skin and made from a mix of natural mineral salts, essential oils and aloe vera.\"}, {'id': 'B001F41IXI', 'title': 'Natural Deodorant Spray by Salt of the Earth, Unscented, Fragrance Free - Vegan, Long Lasting Protection, Leaping Bunny Approved, Made in the UK - 100ml', 'price': 3.39, 'brand': 'Crystal Spring Consumer Division Ltd', 'size': '100 ml (Pack of 1)', 'model': 'CRYS17', 'material': 'Plastic', 'desc': \"★ 100% NATURAL DEODORANT - Certified COSMOS Natural. Free from Aluminium Chlorohydrate and controversial chemicals, it's 100% natural, gentle on your skin and made from a mix of natural mineral salts, essential oils and aloe vera.\"}, {'id': 'B00JXMM9KU', 'title': 'ghd 25 mm Size 1 Ceramic Vented Radial Brush B0-CER25MM', 'price': 17.5, 'brand': 'ghd', 'color': 'Black', 'size': '1 Count (Pack of 1)', 'model': 'PB104BCORXROWXA', 'material': 'Ceramic', 'desc': '25mm diameter barrel'}, {'id': 'B00JXMCZMC', 'title': 'ghd 35 mm Size 2 Ceramic Vented Radial Brush', 'price': 15.0, 'brand': 'ghd', 'color': 'Black', 'size': 'Size 2', 'model': 'PB105BCORXROWXA', 'material': 'Ceramic', 'desc': '35mm diameter barrel'}]\nExplain the basic intentions of this user exactly. Output several different intentions one by one to answer the following question: User buy these items because they want to:\nintention 1: {a simple verb phrase within 10 words}\nintention 2: {a simple verb phrase within 10 words}....\n", "Answer": "Intention 1: Purchase natural deodorants that are gentle on their skin and free from controversial chemicals.\nIntention 2: Refill their natural deodorant spray for long-lasting protection.\nIntention 3: Buy a variety of scents for their natural deodorant spray.\nIntention 4: Purchase a ceramic vented radial brush with a 25mm diameter barrel.\nIntention 5: Purchase a ceramic vented radial brush with a 35mm diameter barrel.", "Next_item": "B074DNXHW9", "Prompt_tokens": 1174, "Completion_tokens": 99, "Intentions": ["Purchase natural deodorants that are gentle on their skin and free from controversial chemicals.", "Refill their natural deodorant spray for long-lasting protection.", "Buy a variety of scents for their natural deodorant spray.", "Purchase a ceramic vented radial brush with a 25mm diameter barrel.", "Purchase a ceramic vented radial brush with a 35mm diameter barrel."]}
{"Session": [{"id": "B07YV9D461", "title": "Garnier Ultimate Blends Shampoo & Conditioner Set | Argan Richness With Moroccan Argan Oil and Almond Cream Nourishing for Dry, Unruly Hair | 360 ml |", "price": 14.99, "brand": "Garnier", "size": "360 ml (Pack of 2)", "model": "5021044126506", "desc": "Argan Oil of Morocco"}, {"id": "B07FDCN61V", "title": "John Frieda Duo Pack Frizz Ease Miraculous Recovery Shampoo and Conditioner, 2 x 500 ml", "price": 20.0, "brand": "John Frieda", "size": "500 ml (Pack of 2)", "model": "2388701", "desc": "Available in 50ml, 250ml & 500ml sizes"}, {"id": "B071JDPPXF", "title": "John Frieda Frizz Ease Dream Curls Shampoo, 250 ml", "price": 5.29, "brand": "John Frieda", "color": "Shampoo", "size": "250 ml (Pack of 1)", "model": "11961", "desc": "250ml bottle"}, {"id": "B092WDWKHN", "title": "John Frieda Frizz Ease Dream Curls SLS/SLES Sulphate Free Shampoo 500 ml (Pack of 1) for Naturally Wavy & Curly Hair", "price": 10.61, "brand": "John Frieda", "size": "500 ml (Pack of 1)", "model": "2761400", "desc": "*SLS/SLES **with no ingredients of animal origin and no animal testing"}, {"id": "B005PMYJBO", "title": "John Frieda Frizz Ease Dream Curls Curl-Defining Conditioner 250 ml for Naturally Wavy & Curly Hair, (Pack of 1)", "price": 4.65, "brand": "John Frieda", "color": "Conditioner", "size": "250 ml (Pack of 1)", "model": "104078814", "desc": "*with no ingredients of animal origin and no animal testing"}, {"id": "B092WJJXS2", "title": "John Frieda Frizz Ease Dream Curls Curl-Defining Conditioner 500 ml (Pack of 1) for Naturally Wavy & Curly Hair", "brand": "John Frieda", "size": "500 ml (Pack of 1)", "model": "2761500", "desc": "*with no ingredients of animal origin and no animal testing"}, {"id": "B092WJJXS2", "title": "John Frieda Frizz Ease Dream Curls Curl-Defining Conditioner 500 ml (Pack of 1) for Naturally Wavy & Curly Hair", "brand": "John Frieda", "size": "500 ml (Pack of 1)", "model": "2761500", "desc": "*with no ingredients of animal origin and no animal testing"}], "Message": "Below is a user chronological record list:\n[{'id': 'B07YV9D461', 'title': 'Garnier Ultimate Blends Shampoo & Conditioner Set | Argan Richness With Moroccan Argan Oil and Almond Cream Nourishing for Dry, Unruly Hair | 360 ml |', 'price': 14.99, 'brand': 'Garnier', 'size': '360 ml (Pack of 2)', 'model': '5021044126506', 'desc': 'Argan Oil of Morocco'}, {'id': 'B07FDCN61V', 'title': 'John Frieda Duo Pack Frizz Ease Miraculous Recovery Shampoo and Conditioner, 2 x 500 ml', 'price': 20.0, 'brand': 'John Frieda', 'size': '500 ml (Pack of 2)', 'model': '2388701', 'desc': 'Available in 50ml, 250ml & 500ml sizes'}, {'id': 'B071JDPPXF', 'title': 'John Frieda Frizz Ease Dream Curls Shampoo, 250 ml', 'price': 5.29, 'brand': 'John Frieda', 'color': 'Shampoo', 'size': '250 ml (Pack of 1)', 'model': '11961', 'desc': '250ml bottle'}, {'id': 'B092WDWKHN', 'title': 'John Frieda Frizz Ease Dream Curls SLS/SLES Sulphate Free Shampoo 500 ml (Pack of 1) for Naturally Wavy & Curly Hair', 'price': 10.61, 'brand': 'John Frieda', 'size': '500 ml (Pack of 1)', 'model': '2761400', 'desc': '*SLS/SLES **with no ingredients of animal origin and no animal testing'}, {'id': 'B005PMYJBO', 'title': 'John Frieda Frizz Ease Dream Curls Curl-Defining Conditioner 250 ml for Naturally Wavy & Curly Hair, (Pack of 1)', 'price': 4.65, 'brand': 'John Frieda', 'color': 'Conditioner', 'size': '250 ml (Pack of 1)', 'model': '104078814', 'desc': '*with no ingredients of animal origin and no animal testing'}, {'id': 'B092WJJXS2', 'title': 'John Frieda Frizz Ease Dream Curls Curl-Defining Conditioner 500 ml (Pack of 1) for Naturally Wavy & Curly Hair', 'brand': 'John Frieda', 'size': '500 ml (Pack of 1)', 'model': '2761500', 'desc': '*with no ingredients of animal origin and no animal testing'}, {'id': 'B092WJJXS2', 'title': 'John Frieda Frizz Ease Dream Curls Curl-Defining Conditioner 500 ml (Pack of 1) for Naturally Wavy & Curly Hair', 'brand': 'John Frieda', 'size': '500 ml (Pack of 1)', 'model': '2761500', 'desc': '*with no ingredients of animal origin and no animal testing'}]\nExplain the basic intentions of this user exactly. Output several different intentions one by one to answer the following question: User buy these items because they want to:\nintention 1: {a simple verb phrase within 10 words}\nintention 2: {a simple verb phrase within 10 words}....\n", "Answer": "Intention 1: Nourish and tame dry, unruly hair.\nIntention 2: Repair and prevent frizz in hair.\nIntention 3: Define and enhance natural curls in hair.", "Next_item": "B01BKOA9DM", "Prompt_tokens": 758, "Completion_tokens": 42, "Intentions": ["Nourish and tame dry, unruly hair.", "Repair and prevent frizz in hair.", "Define and enhance natural curls in hair."]}
{"Session": [{"id": "B078VNVMFD", "title": "Tincogo 6\" Clear Plastic Easels or Stand/Plate Holders to Display Pictures or Other Items at Weddings, Home Decoration, Birthdays, Tables (12 Pack)", "price": 7.98, "brand": "Tincogo", "color": "Clear", "size": "6 inch(12 pack)", "material": "Acrylic", "desc": "Available Size:3\",4\",5\",6\",7\",8\",10\",12\";Please choose the size you prefer;"}, {"id": "B078VN859H", "title": "Tincogo 3\" Clear Plastic Easels or Stand/Plate Holders to Display Pictures or Other Items at Weddings, Home Decoration, Birthdays, Tables (12 Pack)", "price": 4.99, "brand": "Tincogo", "color": "Clear", "size": "3 inch(12 pack)", "material": "Acrylic", "desc": "Available Size:3\",4\",5\",6\",7\",8\",10\",12\";Please choose the size you prefer;"}, {"id": "B0B68V5941", "title": "DIYARTS 6 inch Metal Stands for Display, Plate Stand Metal Photo Holder, Display Stands Metal Frame Holders for Photo, Pictures, Decorative Plate Dish and Tabletop Art", "price": 8.99, "brand": "DIYARTS", "desc": "【Customer Satisfaction Service】If you have any questions or the bracket does not satisfy you, please feel free to contact us. We will provide you with fast support and resolution."}, {"id": "B088RDBS8T", "title": "badiJum Display Stands 6 Inches Picture Frame Stand, Photo Holder Metal Platter Stands, Easel Stand for Decorative Plate Dish Picture Book Artworks,Matte Black 4Pcs Large", "price": 11.13, "brand": "badiJum", "color": "Black", "size": "4 Large (6 '')", "material": "Metal", "desc": "【Choose Correct Dimension Display Stands】: 6''display holder dimension: 5.3 inches(L)*3.0 inches*(W) 6 inches(H), backrest depth 3.5inches fits item of 7'' -15''height. The slant back angle is 45°which shows great visual for your item. What's more the lip depth 1.5inches, that says there is still enough space to hold your object. Buy a set of 4pcs and use them for all your display needs."}, {"id": "B088RD6YWF", "title": "badiJum Metal Stands for Display, 3.3 Inches and 6 Inches Plate Stands, Easel Display Stand, Decorative Picture Frame Stand, Photo Holder for Book, Artworks, Collectibles, Matte Black 4Pcs", "price": 11.99, "brand": "badiJum", "color": "Black", "size": "2 Small (3.3'')+2 Large (6 '')", "material": "Metal", "desc": "【Choose Correct Dimension Display Stands】: 3’’ display holder size: 3.7 (L)*3.0*(W) 3.3 inches(H), backrest depth 3.5inches fits item of 3’’ -9’’ height. 6’’ size: 5.3(L)*3.0 *(W) 6 inches(H), backrest depth 3.5inches fits 7’’ -15’’ height item. The slant back angle is 45°which shows great visual for your item. The lip depth 1.5inches means there is still enough space to hold your object. Buy a set of 4pcs for your display needs."}], "Message": "Below is a user chronological record list:\n[{'id': 'B078VNVMFD', 'title': 'Tincogo 6\" Clear Plastic Easels or Stand/Plate Holders to Display Pictures or Other Items at Weddings, Home Decoration, Birthdays, Tables (12 Pack)', 'price': 7.98, 'brand': 'Tincogo', 'color': 'Clear', 'size': '6 inch(12 pack)', 'material': 'Acrylic', 'desc': 'Available Size:3\",4\",5\",6\",7\",8\",10\",12\";Please choose the size you prefer;'}, {'id': 'B078VN859H', 'title': 'Tincogo 3\" Clear Plastic Easels or Stand/Plate Holders to Display Pictures or Other Items at Weddings, Home Decoration, Birthdays, Tables (12 Pack)', 'price': 4.99, 'brand': 'Tincogo', 'color': 'Clear', 'size': '3 inch(12 pack)', 'material': 'Acrylic', 'desc': 'Available Size:3\",4\",5\",6\",7\",8\",10\",12\";Please choose the size you prefer;'}, {'id': 'B0B68V5941', 'title': 'DIYARTS 6 inch Metal Stands for Display, Plate Stand Metal Photo Holder, Display Stands Metal Frame Holders for Photo, Pictures, Decorative Plate Dish and Tabletop Art', 'price': 8.99, 'brand': 'DIYARTS', 'desc': '【Customer Satisfaction Service】If you have any questions or the bracket does not satisfy you, please feel free to contact us. We will provide you with fast support and resolution.'}, {'id': 'B088RDBS8T', 'title': 'badiJum Display Stands 6 Inches Picture Frame Stand, Photo Holder Metal Platter Stands, Easel Stand for Decorative Plate Dish Picture Book Artworks,Matte Black 4Pcs Large', 'price': 11.13, 'brand': 'badiJum', 'color': 'Black', 'size': \"4 Large (6 '')\", 'material': 'Metal', 'desc': \"【Choose Correct Dimension Display Stands】: 6''display holder dimension: 5.3 inches(L)*3.0 inches*(W) 6 inches(H), backrest depth 3.5inches fits item of 7'' -15''height. The slant back angle is 45°which shows great visual for your item. What's more the lip depth 1.5inches, that says there is still enough space to hold your object. Buy a set of 4pcs and use them for all your display needs.\"}, {'id': 'B088RD6YWF', 'title': 'badiJum Metal Stands for Display, 3.3 Inches and 6 Inches Plate Stands, Easel Display Stand, Decorative Picture Frame Stand, Photo Holder for Book, Artworks, Collectibles, Matte Black 4Pcs', 'price': 11.99, 'brand': 'badiJum', 'color': 'Black', 'size': \"2 Small (3.3'')+2 Large (6 '')\", 'material': 'Metal', 'desc': '【Choose Correct Dimension Display Stands】: 3’’ display holder size: 3.7 (L)*3.0*(W) 3.3 inches(H), backrest depth 3.5inches fits item of 3’’ -9’’ height. 6’’ size: 5.3(L)*3.0 *(W) 6 inches(H), backrest depth 3.5inches fits 7’’ -15’’ height item. The slant back angle is 45°which shows great visual for your item. The lip depth 1.5inches means there is still enough space to hold your object. Buy a set of 4pcs for your display needs.'}]\nExplain the basic intentions of this user exactly. Output several different intentions one by one to answer the following question: User buy these items because they want to:\nintention 1: {a simple verb phrase within 10 words}\nintention 2: {a simple verb phrase within 10 words}....\n", "Answer": "Intention 1: Display pictures or other items at events or home decoration.\nIntention 2: Hold plates or decorative dishes for display.\nIntention 3: Showcase artworks or collectibles.\nIntention 4: Find stands of different sizes and materials for various display needs.", "Next_item": "B09WMXG35D", "Prompt_tokens": 925, "Completion_tokens": 57, "Intentions": ["Display pictures or other items at events or home decoration.", "Hold plates or decorative dishes for display.", "Showcase artworks or collectibles.", "Find stands of different sizes and materials for various display needs."]}
{"Session": [{"id": "B0178HOS28", "title": "Fellowes A4 Laminating Pouches, Gloss Finish, 100 Sheets, 250 Micron (2 x 125 Micron) High Quality Finish with Image Last Directional Quality Mark - Ideal for Photos, Notices and Everyday Use", "price": 19.6, "brand": "Fellowes", "color": "Transparent", "size": "Pack of 100", "model": "5307407", "desc": "GIVE YOUR WORK A PROFESSIONAL FINISH: These premium quality A4 laminating pouches give your work a professional finish and provide protection for frequently handled documents or documents needing to be displayed"}, {"id": "B000NJUWME", "title": "Fellowes A4 Laminating Pouches, Gloss Finish, 100 Sheets, 160 Micron (2 x 80 Micron) High Quality Finish with Image Last Directional Quality Mark - Ideal for Photos and Notices", "price": 11.99, "brand": "Fellowes", "color": "Clear", "size": "Pack of 100", "model": "5306114", "material": "Plastic", "desc": "ENHANCE YOUR DOCUMENTS: One of the best reasons to laminate is to enhance your documents whether it be a photo, important work, notices or protecting your documents from spillages, rips and everyday wear and tear."}, {"id": "B07G17STQF", "title": "CODIRATO 500 Pcs Self Adhesive Dots Tapes Sticky Back Coins Dots with Hook and Loop Velcro Round Pads for Home Office School (White)", "price": 8.99, "brand": "CODIRATO", "color": "White", "material": "Nylon", "desc": "Easy to Use: Just loosen the self adhesive dots and hook points on the card, then stick them to the desired material, it can be reused"}, {"id": "B07G17STQF", "title": "CODIRATO 500 Pcs Self Adhesive Dots Tapes Sticky Back Coins Dots with Hook and Loop Velcro Round Pads for Home Office School (White)", "price": 8.99, "brand": "CODIRATO", "color": "White", "material": "Nylon", "desc": "Easy to Use: Just loosen the self adhesive dots and hook points on the card, then stick them to the desired material, it can be reused"}, {"id": "B000NJUWME", "title": "Fellowes A4 Laminating Pouches, Gloss Finish, 100 Sheets, 160 Micron (2 x 80 Micron) High Quality Finish with Image Last Directional Quality Mark - Ideal for Photos and Notices", "price": 11.99, "brand": "Fellowes", "color": "Clear", "size": "Pack of 100", "model": "5306114", "material": "Plastic", "desc": "ENHANCE YOUR DOCUMENTS: One of the best reasons to laminate is to enhance your documents whether it be a photo, important work, notices or protecting your documents from spillages, rips and everyday wear and tear."}], "Message": "Below is a user chronological record list:\n[{'id': 'B0178HOS28', 'title': 'Fellowes A4 Laminating Pouches, Gloss Finish, 100 Sheets, 250 Micron (2 x 125 Micron) High Quality Finish with Image Last Directional Quality Mark - Ideal for Photos, Notices and Everyday Use', 'price': 19.6, 'brand': 'Fellowes', 'color': 'Transparent', 'size': 'Pack of 100', 'model': '5307407', 'desc': 'GIVE YOUR WORK A PROFESSIONAL FINISH: These premium quality A4 laminating pouches give your work a professional finish and provide protection for frequently handled documents or documents needing to be displayed'}, {'id': 'B000NJUWME', 'title': 'Fellowes A4 Laminating Pouches, Gloss Finish, 100 Sheets, 160 Micron (2 x 80 Micron) High Quality Finish with Image Last Directional Quality Mark - Ideal for Photos and Notices', 'price': 11.99, 'brand': 'Fellowes', 'color': 'Clear', 'size': 'Pack of 100', 'model': '5306114', 'material': 'Plastic', 'desc': 'ENHANCE YOUR DOCUMENTS: One of the best reasons to laminate is to enhance your documents whether it be a photo, important work, notices or protecting your documents from spillages, rips and everyday wear and tear.'}, {'id': 'B07G17STQF', 'title': 'CODIRATO 500 Pcs Self Adhesive Dots Tapes Sticky Back Coins Dots with Hook and Loop Velcro Round Pads for Home Office School (White)', 'price': 8.99, 'brand': 'CODIRATO', 'color': 'White', 'material': 'Nylon', 'desc': 'Easy to Use: Just loosen the self adhesive dots and hook points on the card, then stick them to the desired material, it can be reused'}, {'id': 'B07G17STQF', 'title': 'CODIRATO 500 Pcs Self Adhesive Dots Tapes Sticky Back Coins Dots with Hook and Loop Velcro Round Pads for Home Office School (White)', 'price': 8.99, 'brand': 'CODIRATO', 'color': 'White', 'material': 'Nylon', 'desc': 'Easy to Use: Just loosen the self adhesive dots and hook points on the card, then stick them to the desired material, it can be reused'}, {'id': 'B000NJUWME', 'title': 'Fellowes A4 Laminating Pouches, Gloss Finish, 100 Sheets, 160 Micron (2 x 80 Micron) High Quality Finish with Image Last Directional Quality Mark - Ideal for Photos and Notices', 'price': 11.99, 'brand': 'Fellowes', 'color': 'Clear', 'size': 'Pack of 100', 'model': '5306114', 'material': 'Plastic', 'desc': 'ENHANCE YOUR DOCUMENTS: One of the best reasons to laminate is to enhance your documents whether it be a photo, important work, notices or protecting your documents from spillages, rips and everyday wear and tear.'}]\nExplain the basic intentions of this user exactly. Output several different intentions one by one to answer the following question: User buy these items because they want to:\nintention 1: {a simple verb phrase within 10 words}\nintention 2: {a simple verb phrase within 10 words}....\n", "Answer": "Intention 1: Protect and enhance their documents with laminating pouches.\nIntention 2: Organize and secure items with self-adhesive dots.\nIntention 3: Purchase high-quality office supplies for everyday use.", "Next_item": "B097MJLY51", "Prompt_tokens": 776, "Completion_tokens": 46, "Intentions": ["Protect and enhance their documents with laminating pouches.", "Organize and secure items with self-adhesive dots.", "Purchase high-quality office supplies for everyday use."]}
{"Session": [{"id": "B09P85MS38", "title": "TigTiycH Led Light Up Dog Collar, USB Rechargeable with Water Resistant Reflective Light Up Dogs Collar Flashing Light for the Dark Can Arbitrarily Cut collars,Fits Any dogs(Blue) 1PCS", "price": 8.99, "brand": "TigTiycH", "color": "Blue", "size": "70cm/27.5in", "material": "Silicone", "desc": "3 Light Modes Setting: Easily Setting By Pushing the Button and Change the Lighting Modes Freely: Quick Blink, Slow Blink, Steady Lighting and Off, Fit For Difference Requirements for You."}, {"id": "B09P85KSCW", "title": "TigTiycH Led Light Up Dog Collar, USB Rechargeable with Water Resistant Reflective Light Up Dogs Collar Flashing Light for the Dark Can Arbitrarily Cut collars,Fits Any dogs(Pink) 1PCS", "brand": "TigTiycH", "color": "Pink", "size": "70cm/27.5in", "material": "Silicone", "desc": "3 Light Modes Setting: Easily Setting By Pushing the Button and Change the Lighting Modes Freely: Quick Blink, Slow Blink, Steady Lighting and Off, Fit For Difference Requirements for You."}], "Message": "Below is a user chronological record list:\n[{'id': 'B09P85MS38', 'title': 'TigTiycH Led Light Up Dog Collar, USB Rechargeable with Water Resistant Reflective Light Up Dogs Collar Flashing Light for the Dark Can Arbitrarily Cut collars,Fits Any dogs(Blue) 1PCS', 'price': 8.99, 'brand': 'TigTiycH', 'color': 'Blue', 'size': '70cm/27.5in', 'material': 'Silicone', 'desc': '3 Light Modes Setting: Easily Setting By Pushing the Button and Change the Lighting Modes Freely: Quick Blink, Slow Blink, Steady Lighting and Off, Fit For Difference Requirements for You.'}, {'id': 'B09P85KSCW', 'title': 'TigTiycH Led Light Up Dog Collar, USB Rechargeable with Water Resistant Reflective Light Up Dogs Collar Flashing Light for the Dark Can Arbitrarily Cut collars,Fits Any dogs(Pink) 1PCS', 'brand': 'TigTiycH', 'color': 'Pink', 'size': '70cm/27.5in', 'material': 'Silicone', 'desc': '3 Light Modes Setting: Easily Setting By Pushing the Button and Change the Lighting Modes Freely: Quick Blink, Slow Blink, Steady Lighting and Off, Fit For Difference Requirements for You.'}]\nExplain the basic intentions of this user exactly. Output several different intentions one by one to answer the following question: User buy these items because they want to:\nintention 1: {a simple verb phrase within 10 words}\nintention 2: {a simple verb phrase within 10 words}....\n", "Answer": "Intention 1: Keep their dog visible and safe during walks at night.\nIntention 2: Customize the collar to fit their dog's size.\nIntention 3: Have a collar that is water-resistant and durable.\nIntention 4: Easily switch between different lighting modes for different situations.", "Next_item": "B09P859NTS", "Prompt_tokens": 379, "Completion_tokens": 61, "Intentions": ["Keep their dog visible and safe during walks at night.", "Customize the collar to fit their dog's size.", "Have a collar that is water-resistant and durable.", "Easily switch between different lighting modes for different situations."]}
